### ISSUE TITLE
[debian] Connection resets by peer under certain conditions

### ISSUE THREAD

**Issue by mwennrich** [metal-stack/metal-images#87]
### Following situation:
* k8s cluster with two debian nodes: `Linux 5.10.0-6-amd64 #1 SMP Debian 5.10.28-1 (2021-04-09) x86_64 GNU/Linux`
* loadbalancer-service with `externalTrafficPolicy: Cluster` => loadBalancerIP gets announced from both nodes
* `net.ipv4.fib_multipath_hash_policy = 1`

Occasionally connections to the service get a  `Connection resets by peer` if the connection is routed to the node which is not running the pod matching the service.

### Example:
* pod with 10.244.4.5 listening on port 8090, running on node 10.128.44.2
* service 212.34.83.16 on port 80

tcpdump and conntrack events taken on (the other) node 10.128.44.3:
```
15:41:53.098457 lan0  In  IP 91.58.244.2.46070 > 212.34.83.16.80: Flags [S], seq 3170610516, win 64240, options [mss 1360,sackOK,TS val 2248388122 ecr 0,nop,wscale 7], length 0
15:41:53.098539 lan0  Out IP 10.128.44.3.46005 > 10.244.4.5.8090: Flags [S], seq 3170610516, win 64240, options [mss 1360,sackOK,TS val 2248388122 ecr 0,nop,wscale 7], length 0

15:41:53.098729 lan1  In  IP 10.244.4.5.8090 > 10.128.44.3.46005: Flags [S.], seq 2583202923, ack 3170610517, win 65535, options [mss 8910,sackOK,TS val 521280438 ecr 2248388122,nop,wscale 9], length 0
15:41:53.098775 lan0  Out IP 212.34.83.16.80 > 91.58.244.2.46070: Flags [S.], seq 2583202923, ack 3170610517, win 65535, options [mss 8910,sackOK,TS val 521280438 ecr 2248388122,nop,wscale 9], length 0

15:41:53.118628 lan0  In  IP 91.58.244.2.46070 > 212.34.83.16.80: Flags [.], ack 1, win 502, options [nop,nop,TS val 2248388143 ecr 521280438], length 0

15:41:53.119175 lan0  In  IP 91.58.244.2.46070 > 212.34.83.16.80: Flags [P.], seq 1:82, ack 1, win 502, options [nop,nop,TS val 2248388143 ecr 521280438], length 81: HTTP: GET /hello HTTP/1.1
15:41:53.119238 lan1  Out IP 10.128.44.3.18157 > 10.244.4.5.8090: Flags [P.], seq 3170610517:3170610598, ack 2583202924, win 502, options [nop,nop,TS val 2248388143 ecr 521280438], length 81

15:41:53.119389 lan1  In  IP 10.244.4.5.8090 > 10.128.44.3.18157: Flags [R], seq 2583202924, win 0, length 0
15:41:53.119428 lan0  Out IP 212.34.83.16.80 > 91.58.244.2.46070: Flags [R], seq 2583202924, win 0, length 0

15:41:54.125320 lan0  In  IP 10.244.4.5.8090 > 10.128.44.3.46005: Flags [S.], seq 2583202923, ack 3170610517, win 65535, options [mss 8910,sackOK,TS val 521281464 ecr 2248388122,nop,wscale 9], length 0
15:41:54.125363 lan0  Out IP 10.128.44.3.46005 > 10.244.4.5.8090: Flags [R], seq 3170610517, win 0, length 0
```

```
    [NEW] tcp      6 120 SYN_SENT src=91.58.244.2 dst=212.34.83.16 sport=46070 dport=80 [UNREPLIED] src=10.244.4.5 dst=10.128.44.3 sport=8090 dport=46005
 [UPDATE] tcp      6 60 SYN_RECV src=91.58.244.2 dst=212.34.83.16 sport=46070 dport=80 src=10.244.4.5 dst=10.128.44.3 sport=8090 dport=46005
[DESTROY] tcp      6 src=91.58.244.2 dst=212.34.83.16 sport=46070 dport=80 src=10.244.4.5 dst=10.128.44.3 sport=8090 dport=46005 [ASSURED]
    [NEW] tcp      6 300 ESTABLISHED src=91.58.244.2 dst=212.34.83.16 sport=46070 dport=80 [UNREPLIED] src=10.244.4.5 dst=10.128.44.3 sport=8090 dport=18157
[DESTROY] tcp      6 src=91.58.244.2 dst=212.34.83.16 sport=46070 dport=80 [UNREPLIED] src=10.244.4.5 dst=10.128.44.3 sport=8090 dport=18157
```

==> third packet (ACK) does not get forwarded, the connection does not reach state ESTABLISHED

For comparison following dumps on the same node if the connection succeeds:
```
15:43:00.787651 lan1  In  IP 91.58.244.2.46144 > 212.34.83.16.80: Flags [S], seq 1128669533, win 64240, options [mss 1360,sackOK,TS val 2248455812 ecr 0,nop,wscale 7], length 0
15:43:00.787747 lan0  Out IP 10.128.44.3.56897 > 10.244.4.5.8090: Flags [S], seq 1128669533, win 64240, options [mss 1360,sackOK,TS val 2248455812 ecr 0,nop,wscale 7], length 0

15:43:00.787945 lan0  In  IP 10.244.4.5.8090 > 10.128.44.3.56897: Flags [S.], seq 2428948587, ack 1128669534, win 65535, options [mss 8910,sackOK,TS val 521348127 ecr 2248455812,nop,wscale 9], length 0
15:43:00.787979 lan0  Out IP 212.34.83.16.80 > 91.58.244.2.46144: Flags [S.], seq 2428948587, ack 1128669534, win 65535, options [mss 8910,sackOK,TS val 521348127 ecr 2248455812,nop,wscale 9], length 0

15:43:00.806115 lan1  In  IP 91.58.244.2.46144 > 212.34.83.16.80: Flags [.], ack 1, win 502, options [nop,nop,TS val 2248455829 ecr 521348127], length 0
15:43:00.806162 lan0  Out IP 10.128.44.3.56897 > 10.244.4.5.8090: Flags [.], ack 1, win 502, options [nop,nop,TS val 2248455829 ecr 521348127], length 0

15:43:00.806368 lan1  In  IP 91.58.244.2.46144 > 212.34.83.16.80: Flags [P.], seq 1:82, ack 1, win 502, options [nop,nop,TS val 2248455829 ecr 521348127], length 81: HTTP: GET /hello HTTP/1.1
15:43:00.806385 lan0  Out IP 10.128.44.3.56897 > 10.244.4.5.8090: Flags [P.], seq 1:82, ack 1, win 502, options [nop,nop,TS val 2248455829 ecr 521348127], length 81

15:43:00.806442 lan0  In  IP 10.244.4.5.8090 > 10.128.44.3.56897: Flags [.], ack 82, win 128, options [nop,nop,TS val 521348146 ecr 2248455829], length 0
15:43:00.806453 lan0  Out IP 212.34.83.16.80 > 91.58.244.2.46144: Flags [.], ack 82, win 128, options [nop,nop,TS val 521348146 ecr 2248455829], length 0

(...)
```

```
    [NEW] tcp      6 120 SYN_SENT src=91.58.244.2 dst=212.34.83.16 sport=46144 dport=80 [UNREPLIED] src=10.244.4.5 dst=10.128.44.3 sport=8090 dport=56897
 [UPDATE] tcp      6 60 SYN_RECV src=91.58.244.2 dst=212.34.83.16 sport=46144 dport=80 src=10.244.4.5 dst=10.128.44.3 sport=8090 dport=56897
 [UPDATE] tcp      6 86400 ESTABLISHED src=91.58.244.2 dst=212.34.83.16 sport=46144 dport=80 src=10.244.4.5 dst=10.128.44.3 sport=8090 dport=56897 [ASSURED]
 [UPDATE] tcp      6 120 FIN_WAIT src=91.58.244.2 dst=212.34.83.16 sport=46144 dport=80 src=10.244.4.5 dst=10.128.44.3 sport=8090 dport=56897 [ASSURED]
 [UPDATE] tcp      6 300 CLOSE_WAIT src=91.58.244.2 dst=212.34.83.16 sport=46144 dport=80 src=10.244.4.5 dst=10.128.44.3 sport=8090 dport=56897 [ASSURED]
 [UPDATE] tcp      6 30 LAST_ACK src=91.58.244.2 dst=212.34.83.16 sport=46144 dport=80 src=10.244.4.5 dst=10.128.44.3 sport=8090 dport=56897 [ASSURED]
 [UPDATE] tcp      6 120 TIME_WAIT src=91.58.244.2 dst=212.34.83.16 sport=46144 dport=80 src=10.244.4.5 dst=10.128.44.3 sport=8090 dport=56897 [ASSURED]
[DESTROY] tcp      6 src=91.58.244.2 dst=212.34.83.16 sport=46008 dport=80 src=10.244.4.5 dst=10.128.44.3 sport=8090 dport=19006 [ASSURED]
```

**==> These resets only happen on kernel 5.10 and only if `net.ipv4.fib_multipath_hash_policy = 1`**

**Comment by mwindower** [comment]
That's indeed a problem  -  and I was able to reproduce it!
To be clear: the SYN ACK is received by node 10.128.44.3 but further traffic after that from the client (line 5 in tcpdump) is not passed on to the node where the pod 10.244.4.5 runs.

Multipath is activated on our Ubuntu machines with kernel 5.8 and there we do not have the same issue.
```
cat config-5.8.* | grep -i "CONFIG_IP_ROUTE_MULTIPATH"
CONFIG_IP_ROUTE_MULTIPATH=y
```

I looked up issues and recent changes for the kernel and kube-proxy but could not find anything.
Currently I see only `net.ipv4.fib_multipath_hash_policy = 0` for workers as a fix.

**Comment by majst01** [comment]
We should post this issue to [linux-netdev](https://marc.info/?l=linux-netdev) mailinglist, it might be an overseen issue and should be fixed. I can assist in doing so

**Comment by majst01** [comment]
There is comming something very interesting for our use-case: https://marc.info/?l=linux-netdev&m=162057344703025&w=2

**Comment by mwennrich** [comment]
(same behaviour with `5.11.0-17-generic / Ubuntu 21.04`)

**Comment by mwindower** [comment]
But then we should deactivate the setting for all worker images and file the issue to the mailinglist.

**Comment by majst01** [comment]
we could just move this particular sysctl value from the debian to the firewall subdirectory
